Nombre	Warm Up	Ejercicio 1.1	Serie-Reps 1.1	% 1.1	Ejercicio 1.2	Serie-Reps 1.2	% 1.2	Intermedio 1	Ejercicio 2.1	Serie-Reps 2.1	% 2.1	Ejercicio 2.2	Serie-Reps 2.2	% 2.2	Intermedio 2	Ejercicio 3.1	Serie-Reps 3.1	% 3.1	Ejercicio 3.2	Serie-Reps 3.2	% 3.2	extra	Observaciones	Imagen 1	Imagen 2	TEST
19/03/2025   CATEGORIA MAYOR HEAVY (O LINE & D LINE) 	Dynamic  warm up/ 20  jumping jackets/ 10 Burpees / 10 pop squats/ 10 squat jump/  10 split jump.	ZERCHER SQUAT	 4 X 4	                          75 % 1RM	DB  GOBLET SQUAT EN BOSU DOME DOWN	4 X 4	HEAVY WT	PWR STEP UP MD WT 3 X 12 EACH LEG	BENCH PRESS                                 (DESACELERACIÓN & ACELERACIÓN)	SACAR LA BARRA, SOLTARLA Y DEJARLA CAER , CACHAR Y AL CAHCAR SUBIR EXPLOSIVO) 3 X 10	BARRA DE 20 KG CON DOS DISCOS DE 45LBS	BB BICEP CURL &  SHOULDER PRESS INVERTED	3 X 6	75% 1 RM	INCLINE BENCH PRESS  3 X 10 85% 1RM  4 TIEMPOS	HARNESS NECK FOUR WAYS	2 X 4 X 10 EACH SIDE	CABLE MACHINE	SKILL DEVELOPMENT EXCERCISES          ( CAMPO)	SKILL SET 1	DEFENSIVE LINE VER SKILL PATTERNS	OFFENSIVE LINE VER SKILL PATTERNS		informacion/Defensive Line Skill Patterns.jpeg	informacion/Offensive Line Skill Patterns.jpeg	
20/03/2025   CATEGORIA MAYOR HEAVY (O LINE & D LINE)	Dynamic  warm up/ 20  jumping jackets/ 10 Burpees / 10 pop squats/ 10 squat jump/  10 split jump.	SHRUGS & PWR HIGH PULL	3 SHRUGS X 1 HIGH PULL /  X 3 SETS	85% 1 RM	POWER CLEAN  & JERK 	3 X 3	85% 1 RM	HAMMER JAMMER BANDED  PWR STEP 3 X 8 EXPLOSIVO	BB RDL 	2 X 8 	75% 1RM	DB HIGH ROW	3 X 6	HG WT	REVERSE HYPER EXTENSION 2 X 6 EXPLOSIVOS	BB HIP THRUST	2 X 8	75% 1 RM	PONER EL MAYOR PESO POSIBLE EN TRINEOS NEGROS- COLOCAR EL TRINEO FUERA DEL GIMNASIO  EMPUJAR  CON PASOS CORTOS 10 YDS Y LUEGO JALAR EN CONTRA CON PASOS CORTOS( NO ES TRABAJO DE RAPIDEZ ES DE FUERZA)	X 2 SETS	EMPUJO-JALO-EMPUJO-JALO					
20/03/2025   CATEGORIA  JUVENIL	Dynamic  warm up/ 20  jumping jackets/ 10 Burpees / 10 pop squats/ 10 squat jump/  10 split jump.	PWR CLEAN 	4 SETS  ( REALIZAR 1 SET DESCANSO Y LUEGO EL OTRO)                           	1 X 7 75%      1 X 5 80%    1 X 3 85%         1 X 1 90%	DEPTH TO BROAD JUMP                              ( BANCO DEJARSE CAER Y DAR UN BROAD JUMP)	4 SETS X 3 REPS CADA SET	BODY WT	SLAM MED BALL 3 X 6 	INCLINE BENCH PRESS 	3 SETS              ( REALIZAR 1 SET DESCANSO Y LUEGO EL OTRO)                           	1X7 75%   1X5 80%   1X3 85%	DROP IN PLYO PUSH UPS ( COLOCAR CUATRO DISCOS EN EL PISO 2 DE CADA LADO, COLOCAR LA MANOS EN POSICION POR DENTRO LOS DISCOS HACER UN PUSH UPS ABIERTO A LOS DISCOS Y CAER DE NUEVO.	 3 X 5 EXPLOSIVAS	CHALECO	DB SQUAT JUMP 3 X 3 ESPLOSIVAS MD WT	BANDED VERT JUMP( SUJETANDO CON AMBOS BRAZOS LA LIGA BAJO Y ME IMPULSO)	3 X 5 EXPLOSIVOS	BANDED 	SHOULDER PWR PRESS 	3 X 	1X4 75%   1X3 80%   1X2 85%	BICEP CURL LIBRE / 50 V UPS CON DISCO				
21/03/2025   CATEGORIA MAYOR HEAVY (O LINE & D LINE) 	Dynamic  warm up/ 20  jumping jackets/ 10 Burpees / 10 pop squats/ 10 squat jump/  10 split jump.	SQUAT	4 SETS  ( REALIZAR 1 SET DESCANSO Y LUEGO EL OTRO)                           	1 X 7 75%      1 X 5 80%    1 X 3 85%         1 X 1 90%	DB  GOBLET LATERAL LOUNGE	4 X 4	HEAVY WT	PWR STEP UP MD WT 3 X 12 EACH LEG	FLOOR BENCH PRESS	4 X 10	85%1RM	BB BICEP CURL &  SHOULDER PRESS INVERTED	3 X 6	75% 1 RM	UPRIGHT ROW 3 X 8 HG WT	HARNESS NECK FOUR WAYS	2 X 4 X 10 EACH SIDE	CABLE MACHINE	SKILL DEVELOPMENT EXCERCISES          ( CAMPO)	SKILL SET 2						
22/03/2025   CATEGORIA MAYOR( HEAVY O LINE & DLINE)	Dynamic  warm up/ 20  jumping jackets/ 10 Burpees / 10 pop squats/ 10 squat jump/  10 split jump.	DB ALT HAMMER BICEP CURL 	3 X 10	MD WT	TRICEP CABLE EXTENSION 	3 X 10	HEAVY WT	4 X 8 DIPS CON PESO	BICEP CURL CON BARRA DE 20 KGS	2 X 8 BAJANDO EN CUATRO TIEMPOS	85 % 1RM	BISERIE PRESS FRANCES CON BARRA Z / BECH PRESS CLOSE  	REALIZAR CONTINUO 1 X 12 & 2 X 10 ESA ES UNA SERIE HACER 2	SKILL PLATES 10 A 15 KGS  MEDIUMS Y HEAVIES 15 A 20 KGS	DB BICEP ALTERNATING CURL 2 X 10 EACH ARM	PUSH UP DIAMON 	2 X 10	PLATE IN BACK	CHIN UPS	2 X 10	CHALECO	TROTE AL FINAL 20 MINUTOS				
18/03/2025 Y 20/03/2025 MEDIUMS & SKILLS  ( SI HAY SESION DE FUERZA POR PASSING CAMP)	Dynamic  warm up/ 20  jumping jackets/ 10 Burpees / 10 pop squats/ 10 squat jump/  10 split jump.	PWR CLEAN 	3 X 3 	75% 1RM	DEPTH TO BROAD JUMP                              ( BANCO DEJARSE CAER Y DAR UN BROAD JUMP)	3 SETS X 3 REPS CADA SET	BODY WT	SLAM MED BALL 3 X  3	INCLINE BENCH PRESS 	3 X 3	85% 1RM	DROP IN PLYO PUSH UPS ( COLOCAR CUATRO DISCOS EN EL PISO 2 DE CADA LADO, COLOCAR LA MANOS EN POSICION POR DENTRO LOS DISCOS HACER UN PUSH UPS ABIERTO A LOS DISCOS Y CAER DE NUEVO.	 3 X 5 EXPLOSIVAS	PLYO	DB SQUAT JUMP 3 X 3 ESPLOSIVAS MD WT	BANDED VERT JUMP( SUJETANDO CON AMBOS BRAZOS LA LIGA BAJO Y ME IMPULSO)	3 X 5 EXPLOSIVOS	BANDED 	SHOULDER PWR PRESS 	3X 3	85% 1RM	BICEP CURL LIBRE / 30 V UPS CON DISCO				